{
  "schema_version": 1,
  "run_id": "run_20260608_073634_campaign_adas_v1.0_promote",
  "campaign_id": "campaign_adas_v1.0",
  "campaign_file": "deploy/campaign_runs/.runtime/campaign_adas_v1.0_runtime.json",
  "rollout_policy_id": "policy_single_car_candidate_manual_promote_adas_v1.0",
  "phase": "promote",
  "status": "success",
  "started_at": "2026-06-08T07:36:33",
  "finished_at": "2026-06-08T07:39:06",
  "feature": "ADAS",
  "target_version": "v1.0",
  "target_role": "primary",
  "legacy_slot": "B",
  "docker_runtime": {
    "requested": true,
    "mode": "promote",
    "pull_requested": false,
    "pull_policy": "",
    "image": "localhost:5000/sdv/adas-feature:v1.0"
  },
  "resolved_targets": ["car_1","car_10","car_5"],
  "aggregate": {
    "total": 3,
    "success": 3,
    "failed": 0
  },
  "per_vehicle": [
    {
      "car_id": "car_1",
      "result": "success",
      "reason": "",
      "deploy_id": "deploy_20260608_073637_001",
      "state_updated": true,
      "config_synced": true,
      "docker_runtime_result": "success",
      "docker_runtime_mode": "promote",
      "docker_runtime_action": "promote",
      "docker_runtime_image": "localhost:5000/sdv/adas-feature:v1.0",
      "docker_runtime_container": "car_1_agent_adas",
      "state_file": "deploy/state/car_1.json",
      "config_file": "config/car/car_1.conf",
      "history_path": "deploy/history/fleet_history.jsonl",
      "fleet_deploy_command": "fleet-deploy vehicle car_1 ADAS B v1.0 --sync-config --no-defer-native --docker-runtime=promote"
    },
    {
      "car_id": "car_10",
      "result": "success",
      "reason": "",
      "deploy_id": "deploy_20260608_073723_002",
      "state_updated": true,
      "config_synced": true,
      "docker_runtime_result": "success",
      "docker_runtime_mode": "promote",
      "docker_runtime_action": "promote",
      "docker_runtime_image": "localhost:5000/sdv/adas-feature:v1.0",
      "docker_runtime_container": "car_10_agent_adas",
      "state_file": "deploy/state/car_10.json",
      "config_file": "config/car/car_10.conf",
      "history_path": "deploy/history/fleet_history.jsonl",
      "fleet_deploy_command": "fleet-deploy vehicle car_10 ADAS B v1.0 --sync-config --no-defer-native --docker-runtime=promote"
    },
    {
      "car_id": "car_5",
      "result": "success",
      "reason": "",
      "deploy_id": "deploy_20260608_073814_003",
      "state_updated": true,
      "config_synced": true,
      "docker_runtime_result": "success",
      "docker_runtime_mode": "promote",
      "docker_runtime_action": "promote",
      "docker_runtime_image": "localhost:5000/sdv/adas-feature:v1.0",
      "docker_runtime_container": "car_5_agent_adas",
      "state_file": "deploy/state/car_5.json",
      "config_file": "config/car/car_5.conf",
      "history_path": "deploy/history/fleet_history.jsonl",
      "fleet_deploy_command": "fleet-deploy vehicle car_5 ADAS B v1.0 --sync-config --no-defer-native --docker-runtime=promote"
    }
  ],
  "warnings": [],
  "failures": []
}
