{
  "schema_version": 1,
  "run_id": "run_20260527_141918_campaign_navigation_v3.0_car3_canary_promote",
  "campaign_id": "campaign_navigation_v3.0_car3_canary",
  "campaign_file": "deploy/campaigns/campaign_navigation_v3.0_car3_canary.json",
  "rollout_policy_id": "policy_single_car_candidate_manual_promote_nav_v3.0",
  "phase": "promote",
  "status": "success",
  "started_at": "2026-05-27T14:19:18",
  "finished_at": "2026-05-27T14:19:43",
  "feature": "Navigation",
  "target_version": "v3.0",
  "target_role": "primary",
  "legacy_slot": "B",
  "docker_runtime": {
    "requested": true,
    "mode": "promote",
    "pull_requested": false,
    "pull_policy": "",
    "image": "localhost:5000/sdv/navigation-feature:v3.0"
  },
  "resolved_targets": ["car_3"],
  "aggregate": {
    "total": 1,
    "success": 1,
    "failed": 0
  },
  "per_vehicle": [
    {
      "car_id": "car_3",
      "result": "success",
      "reason": "",
      "deploy_id": "deploy_20260527_141918_001",
      "state_updated": true,
      "config_synced": true,
      "docker_runtime_result": "success",
      "docker_runtime_mode": "promote",
      "docker_runtime_action": "promote",
      "docker_runtime_image": "localhost:5000/sdv/navigation-feature:v3.0",
      "docker_runtime_container": "car_3_agent_navigation",
      "state_file": "deploy/state/car_3.json",
      "config_file": "config/car/car_3.conf",
      "history_path": "deploy/history/fleet_history.jsonl",
      "fleet_deploy_command": "fleet-deploy vehicle car_3 Navigation B v3.0 --sync-config --no-defer-native --docker-runtime=promote"
    }
  ],
  "warnings": [],
  "failures": []
}
