{
  "schema_version": 1,
  "run_id": "run_20260601_212339_campaign_navigation_v3.0_promote",
  "campaign_id": "campaign_navigation_v3.0",
  "campaign_file": "deploy/campaign_runs/.runtime/campaign_navigation_v3.0_runtime_EU.json",
  "rollout_policy_id": "policy_single_car_candidate_manual_promote_nav_v3.0",
  "phase": "promote",
  "status": "success",
  "started_at": "2026-06-01T21:23:39",
  "finished_at": "2026-06-01T21:23:40",
  "feature": "Navigation",
  "target_version": "v3.0",
  "target_role": "primary",
  "legacy_slot": "B",
  "docker_runtime": {
    "requested": true,
    "mode": "promote",
    "pull_requested": false,
    "pull_policy": "",
    "image": "localhost:5000/sdv/navigation-feature:v3.0"
  },
  "resolved_targets": ["car_4","car_7"],
  "aggregate": {
    "total": 2,
    "success": 2,
    "failed": 0
  },
  "per_vehicle": [
    {
      "car_id": "car_4",
      "result": "success",
      "reason": "",
      "deploy_id": "deploy_20260601_212339_001",
      "state_updated": true,
      "config_synced": true,
      "docker_runtime_result": "pending",
      "docker_runtime_mode": "promote",
      "docker_runtime_action": "deferred_promote",
      "docker_runtime_image": "",
      "docker_runtime_container": "",
      "state_file": "deploy/state/car_4.json",
      "config_file": "config/car/car_4.conf",
      "history_path": "deploy/history/fleet_history.jsonl",
      "fleet_deploy_command": "fleet-deploy vehicle car_4 Navigation B v3.0 --sync-config --no-defer-native --docker-runtime=promote"
    },
    {
      "car_id": "car_7",
      "result": "success",
      "reason": "",
      "deploy_id": "deploy_20260601_212340_002",
      "state_updated": true,
      "config_synced": true,
      "docker_runtime_result": "pending",
      "docker_runtime_mode": "promote",
      "docker_runtime_action": "deferred_promote",
      "docker_runtime_image": "",
      "docker_runtime_container": "",
      "state_file": "deploy/state/car_7.json",
      "config_file": "config/car/car_7.conf",
      "history_path": "deploy/history/fleet_history.jsonl",
      "fleet_deploy_command": "fleet-deploy vehicle car_7 Navigation B v3.0 --sync-config --no-defer-native --docker-runtime=promote"
    }
  ],
  "warnings": [],
  "failures": []
}
