{
  "schema_version": 1,
  "run_id": "run_20260601_225131_campaign_adas_v7.7_promote",
  "campaign_id": "campaign_adas_v7.7",
  "campaign_file": "deploy/campaign_runs/.runtime/campaign_adas_v7.7_runtime.json",
  "rollout_policy_id": "policy_single_car_candidate_manual_promote_v7.7",
  "phase": "promote",
  "status": "success",
  "started_at": "2026-06-01T22:51:31",
  "finished_at": "2026-06-01T22:51:35",
  "feature": "ADAS",
  "target_version": "v7.7",
  "target_role": "primary",
  "legacy_slot": "B",
  "docker_runtime": {
    "requested": true,
    "mode": "promote",
    "pull_requested": false,
    "pull_policy": "",
    "image": "localhost:5000/sdv/adas-feature:v7.7"
  },
  "resolved_targets": ["car_1"],
  "aggregate": {
    "total": 1,
    "success": 1,
    "failed": 0
  },
  "per_vehicle": [
    {
      "car_id": "car_1",
      "result": "success",
      "reason": "",
      "deploy_id": "deploy_20260601_225133_001",
      "state_updated": true,
      "config_synced": true,
      "docker_runtime_result": "pending",
      "docker_runtime_mode": "promote",
      "docker_runtime_action": "deferred_promote",
      "docker_runtime_image": "",
      "docker_runtime_container": "",
      "state_file": "deploy/state/car_1.json",
      "config_file": "config/car/car_1.conf",
      "history_path": "deploy/history/fleet_history.jsonl",
      "fleet_deploy_command": "fleet-deploy vehicle car_1 ADAS B v7.7 --sync-config --no-defer-native --docker-runtime=promote"
    }
  ],
  "warnings": [],
  "failures": []
}
