{
  "schema_version": 1,
  "run_id": "run_20260602_074926_campaign_navigation_v7.7_candidate",
  "campaign_id": "campaign_navigation_v7.7",
  "campaign_file": "deploy/campaign_runs/.runtime/campaign_navigation_v7.7_runtime.json",
  "rollout_policy_id": "policy_single_car_candidate_manual_promote_nav_v7.7",
  "phase": "candidate",
  "status": "success",
  "started_at": "2026-06-02T07:49:26",
  "finished_at": "2026-06-02T07:50:19",
  "feature": "Navigation",
  "target_version": "v7.7",
  "target_role": "candidate",
  "legacy_slot": "B",
  "docker_runtime": {
    "requested": true,
    "mode": "candidate",
    "pull_requested": true,
    "pull_policy": "missing",
    "image": "localhost:5000/sdv/navigation-feature:v7.7"
  },
  "resolved_targets": ["car_2","car_3","car_9"],
  "aggregate": {
    "total": 3,
    "success": 3,
    "failed": 0
  },
  "per_vehicle": [
    {
      "car_id": "car_2",
      "result": "success",
      "reason": "",
      "deploy_id": "deploy_20260602_074926_001",
      "state_updated": true,
      "config_synced": true,
      "docker_runtime_result": "success",
      "docker_runtime_mode": "candidate",
      "docker_runtime_action": "deploy-shadow",
      "docker_runtime_image": "localhost:5000/sdv/navigation-feature:v7.7",
      "docker_runtime_container": "car_2_agent_navigation_shadow",
      "state_file": "deploy/state/car_2.json",
      "config_file": "config/car/car_2.conf",
      "history_path": "deploy/history/fleet_history.jsonl",
      "fleet_deploy_command": "fleet-deploy vehicle car_2 Navigation B v7.7 --sync-config --no-defer-native --docker-runtime=candidate --docker-pull=missing"
    },
    {
      "car_id": "car_3",
      "result": "success",
      "reason": "",
      "deploy_id": "deploy_20260602_074937_002",
      "state_updated": true,
      "config_synced": true,
      "docker_runtime_result": "success",
      "docker_runtime_mode": "candidate",
      "docker_runtime_action": "deploy-shadow",
      "docker_runtime_image": "localhost:5000/sdv/navigation-feature:v7.7",
      "docker_runtime_container": "car_3_agent_navigation_shadow",
      "state_file": "deploy/state/car_3.json",
      "config_file": "config/car/car_3.conf",
      "history_path": "deploy/history/fleet_history.jsonl",
      "fleet_deploy_command": "fleet-deploy vehicle car_3 Navigation B v7.7 --sync-config --no-defer-native --docker-runtime=candidate --docker-pull=missing"
    },
    {
      "car_id": "car_9",
      "result": "success",
      "reason": "",
      "deploy_id": "deploy_20260602_074951_003",
      "state_updated": true,
      "config_synced": true,
      "docker_runtime_result": "success",
      "docker_runtime_mode": "candidate",
      "docker_runtime_action": "deploy-shadow",
      "docker_runtime_image": "localhost:5000/sdv/navigation-feature:v7.7",
      "docker_runtime_container": "car_9_agent_navigation_shadow",
      "state_file": "deploy/state/car_9.json",
      "config_file": "config/car/car_9.conf",
      "history_path": "deploy/history/fleet_history.jsonl",
      "fleet_deploy_command": "fleet-deploy vehicle car_9 Navigation B v7.7 --sync-config --no-defer-native --docker-runtime=candidate --docker-pull=missing"
    }
  ],
  "warnings": [],
  "failures": []
}
