{
  "schema_version": 1,
  "run_id": "run_20260527_110346_campaign_adas_v13.0_car10_canary_promote",
  "campaign_id": "campaign_adas_v13.0_car10_canary",
  "campaign_file": "deploy/campaigns/campaign_adas_v13.0_car10_canary.json",
  "rollout_policy_id": "policy_single_car_candidate_manual_promote_v13.0",
  "phase": "promote",
  "status": "failed",
  "started_at": "2026-05-27T11:03:46",
  "finished_at": "2026-05-27T11:03:47",
  "feature": "ADAS",
  "target_version": "v13.0",
  "target_role": "primary",
  "legacy_slot": "B",
  "docker_runtime": {
    "requested": true,
    "mode": "promote",
    "pull_requested": false,
    "pull_policy": "",
    "image": "localhost:5000/sdv/adas-feature:v13.0"
  },
  "resolved_targets": ["car_10"],
  "aggregate": {
    "total": 1,
    "success": 0,
    "failed": 1
  },
  "per_vehicle": [
    {
      "car_id": "car_10",
      "result": "failed",
      "reason": "update_mode is not READY",
      "deploy_id": "deploy_20260527_110346_001",
      "state_updated": false,
      "config_synced": false,
      "docker_runtime_result": "",
      "docker_runtime_mode": "promote",
      "docker_runtime_action": "",
      "docker_runtime_image": "",
      "docker_runtime_container": "",
      "state_file": "deploy/state/car_10.json",
      "config_file": "config/car/car_10.conf",
      "history_path": "deploy/history/fleet_history.jsonl",
      "fleet_deploy_command": "fleet-deploy vehicle car_10 ADAS B v13.0 --sync-config --no-defer-native --docker-runtime=promote"
    }
  ],
  "warnings": ["update_mode is not READY for car_10 (current=COMPLETED)"],
  "failures": ["car_10: update_mode is not READY"]
}
