{
  "schema_version": 1,
  "run_id": "run_20260526_105127_campaign_adas_v0.6_car2_canary_promote",
  "campaign_id": "campaign_adas_v0.6_car2_canary",
  "campaign_file": "deploy/campaigns/campaign_adas_v0.6_car2_canary.json",
  "rollout_policy_id": "policy_single_car_candidate_manual_promote_v0.6",
  "phase": "promote",
  "status": "success",
  "started_at": "2026-05-26T10:51:27",
  "finished_at": "2026-05-26T10:51:29",
  "feature": "ADAS",
  "target_version": "v0.6",
  "target_role": "primary",
  "legacy_slot": "B",
  "docker_runtime": {
    "requested": true,
    "mode": "promote",
    "pull_requested": false,
    "pull_policy": "",
    "image": "localhost:5000/sdv/adas-feature:v0.6"
  },
  "resolved_targets": ["car_2"],
  "aggregate": {
    "total": 1,
    "success": 1,
    "failed": 0
  },
  "per_vehicle": [
    {
      "car_id": "car_2",
      "result": "success",
      "reason": "",
      "deploy_id": "deploy_20260526_105127_001",
      "state_updated": true,
      "config_synced": false,
      "docker_runtime_result": "failed",
      "docker_runtime_mode": "promote",
      "docker_runtime_action": "promote",
      "docker_runtime_image": "localhost:5000/sdv/adas-feature:v0.6",
      "docker_runtime_container": "car_2_agent_adas",
      "state_file": "deploy/state/car_2.json",
      "config_file": "config/car/car_2.conf",
      "history_path": "deploy/history/fleet_history.jsonl",
      "fleet_deploy_command": "fleet-deploy vehicle car_2 ADAS B v0.6 --sync-config --no-defer-native --docker-runtime=promote"
    }
  ],
  "warnings": [],
  "failures": []
}
