{
  "schema_version": 1,
  "run_id": "run_20260608_083656_campaign_energy_v1.0_promote",
  "campaign_id": "campaign_energy_v1.0",
  "campaign_file": "deploy/campaign_runs/.runtime/campaign_energy_v1.0_runtime.json",
  "rollout_policy_id": "policy_single_car_candidate_manual_promote_energy_v1.0",
  "phase": "promote",
  "status": "success",
  "started_at": "2026-06-08T08:36:56",
  "finished_at": "2026-06-08T08:38:13",
  "feature": "Energy",
  "target_version": "v1.0",
  "target_role": "primary",
  "legacy_slot": "B",
  "docker_runtime": {
    "requested": true,
    "mode": "promote",
    "pull_requested": false,
    "pull_policy": "",
    "image": "localhost:5000/sdv/evenergy-feature:v1.0"
  },
  "resolved_targets": ["car_4","car_5"],
  "aggregate": {
    "total": 2,
    "success": 2,
    "failed": 0
  },
  "per_vehicle": [
    {
      "car_id": "car_4",
      "result": "success",
      "reason": "",
      "deploy_id": "deploy_20260608_083658_001",
      "state_updated": true,
      "config_synced": true,
      "docker_runtime_result": "success",
      "docker_runtime_mode": "promote",
      "docker_runtime_action": "promote",
      "docker_runtime_image": "localhost:5000/sdv/evenergy-feature:v1.0",
      "docker_runtime_container": "car_4_agent_evenergy",
      "state_file": "deploy/state/car_4.json",
      "config_file": "config/car/car_4.conf",
      "history_path": "deploy/history/fleet_history.jsonl",
      "fleet_deploy_command": "fleet-deploy vehicle car_4 Energy B v1.0 --sync-config --no-defer-native --docker-runtime=promote"
    },
    {
      "car_id": "car_5",
      "result": "success",
      "reason": "",
      "deploy_id": "deploy_20260608_083745_002",
      "state_updated": true,
      "config_synced": true,
      "docker_runtime_result": "success",
      "docker_runtime_mode": "promote",
      "docker_runtime_action": "promote",
      "docker_runtime_image": "localhost:5000/sdv/evenergy-feature:v1.0",
      "docker_runtime_container": "car_5_agent_evenergy",
      "state_file": "deploy/state/car_5.json",
      "config_file": "config/car/car_5.conf",
      "history_path": "deploy/history/fleet_history.jsonl",
      "fleet_deploy_command": "fleet-deploy vehicle car_5 Energy B v1.0 --sync-config --no-defer-native --docker-runtime=promote"
    }
  ],
  "warnings": [],
  "failures": []
}
