{
  "schema_version": 1,
  "run_id": "run_20260601_194829_campaign_navigation_v3.0_promote",
  "campaign_id": "campaign_navigation_v3.0",
  "campaign_file": "deploy/campaign_runs/.runtime/campaign_navigation_v3.0_runtime.json",
  "rollout_policy_id": "policy_single_car_candidate_manual_promote_nav_v3.0",
  "phase": "promote",
  "status": "failed",
  "started_at": "2026-06-01T19:48:29",
  "finished_at": "2026-06-01T19:48:38",
  "feature": "Navigation",
  "target_version": "v3.0",
  "target_role": "primary",
  "legacy_slot": "B",
  "docker_runtime": {
    "requested": true,
    "mode": "promote",
    "pull_requested": false,
    "pull_policy": "",
    "image": "localhost:5000/sdv/navigation-feature:v3.0"
  },
  "resolved_targets": ["car_1"],
  "aggregate": {
    "total": 1,
    "success": 0,
    "failed": 1
  },
  "per_vehicle": [
    {
      "car_id": "car_1",
      "result": "failed",
      "reason": "update_mode is not READY",
      "deploy_id": "deploy_20260601_194833_001",
      "state_updated": false,
      "config_synced": false,
      "docker_runtime_result": "",
      "docker_runtime_mode": "promote",
      "docker_runtime_action": "",
      "docker_runtime_image": "",
      "docker_runtime_container": "",
      "state_file": "deploy/state/car_1.json",
      "config_file": "config/car/car_1.conf",
      "history_path": "deploy/history/fleet_history.jsonl",
      "fleet_deploy_command": "fleet-deploy vehicle car_1 Navigation B v3.0 --sync-config --no-defer-native --docker-runtime=promote"
    }
  ],
  "warnings": ["update_mode is not READY for car_1 (current=COMPLETED)"],
  "failures": ["car_1: update_mode is not READY"]
}
